,female_disease,female_risk,female_disease_ratio,lifestyle
3,高血脂,高风险,9.92,食物避免油炸、油煎或油酥的食物、带皮的肉类、胆固醇含量高的食物(动物内脏或蟹黄)。高纤维食物可在肠道结合胆固醇，减少其吸收。包括：五榖根茎类(如糙米、胚芽米、全麦面包等)、未加工的豆类(黄豆、红豆、绿豆等)、各类蔬菜(如叶菜类、竹笋、四季豆等)、各类水果。
4,高尿酸血症,高风险,2.12,避免过量饮酒。每日饮用至少2000C.C的白开水(不包括饮料、果汁、咖啡)且不憋尿。减少应酬和大鱼大肉的频率。应尽量避免普林含量高之动物内脏(如脑、肝、腰子等)、海鲜(牡蛎、蛤、小管、小鱼干、吻仔鱼、虱目鱼、吴郭鱼等)、肉汤、肉汁、鸡精等。
13,肌少症,高风险,2.45,摄取充足的蛋白质，高龄者要预防肌少症蛋白质需要量建议为1-1.5公克/公斤，建议热量需求为30-40大卡/公斤。规律的运动，维持肌肉的力量，使体能活动不至于下降，进而减少跌倒的机会。阻力运动可藉由增加肌肉细胞中蛋白质的合成，改善肌力及肌肉量，如深蹲、仰卧起坐、侧抬腿等；而有氧运动包括慢跑、健走、游泳、骑脚踏车等，能够促使骨骼肌增大，并增加肌肉量。
15,子宫肌瘤,高风险,8.28,建议维持正常体重，应避免高油脂、高热量食物如炸鸡排，不要过度进补，营养均衡以维持良好免疫力，并可摄取益生菌以调节免疫力。可多摄取蔬果与优质蛋白质如鱼肉，帮助维持肝脏机能正常运作，避免因肝脏机能降低而导致体内雌二醇过多刺激肌瘤生成。少吃豆制品、带壳海鲜等破坏体内雌激素平衡的食物。
31,高度近视,高风险,2.68,至少每半年到眼科诊所作眼底散瞳检查，若有早期病变如裂孔，先予以雷射治疗。以防止恶化成视网膜剥离。平时多补充适量的维生素A、C、E，多少有所帮助。
43,口腔癌,高风险,2.63,绝大部分的口腔癌发生与抽烟、喝酒、嚼槟榔相关，高风险者宜避免上述习惯。每半年应定期做口腔健康检查，并实行正确的刷牙方式，维持口腔卫生。饮食上可多摄取蔬菜及富含维生素C之水果（如芭乐、柑橘类），并避免过烫或太辣、太酸的刺激性食物。
46,肺癌,高风险,2.21,肺癌的防治宜从改善生活中的危险因子开始：不养成吸烟习惯或吸烟者立即戒烟，避免暴露在二手烟环境。饮食上则需改变容易造成油烟的烹调方式，例如以炖煮或烤箱料理代替油煎和油炒，并使用抽油烟机，维持通风良好。另外在空气污染程度高的日子需配戴口罩。
47,胃癌,高风险,3.11,胃癌和饮食内容息息相关，饮食上宜避免油炸、烟熏、腌渍食物。可多摄取高丽菜、及富含黏液之蔬菜如秋葵及山药。另外也应减少刺激性食物如酒精、浓茶及咖啡的摄取，减少刺激肠胃黏膜。幽门螺旋杆菌感染亦会增加其风险，除了至医院做吹气检测外，日常中亦可补充益生菌。
