,female_disease,female_risk,female_disease_ratio,lifestyle
11,退化性關節炎,高風險,3.06,首要目標便是控制體重，維持理想體重以減輕關節的負擔。避免油炸油煎類的食物去破壞關節的軟骨。建議可以多選用含有Omega-3脂肪酸(鮭魚、鮪魚、鯖魚、秋刀魚)、能抗發炎物質的香辛料(蔥、薑、蒜、辣椒、咖哩)以及富含有多酚類、類黃酮的蔬果(甜椒、櫻桃、柳丁、橘子、葡萄柚、葡萄)。
19,紅斑性狼瘡,高風險,2.03,平時生活作息應規律、適度休息。避免陽光曝曬。飲食避免食用可能富含雌性荷爾蒙之食物、避免以口服避孕葯或子宮內避孕器方式避孕。降低攝取易導致過敏食物(海鮮類)。食材可選用能調節免疫功能及抗氧化抗發炎的食物為主，例如含有Omega-3脂肪酸(鮭魚、鮪魚、鯖魚、秋刀魚)、富含維生素C(木瓜、鳳梨、草莓、青椒、芥藍、菠菜、花椰菜)、維生素E(胚芽、堅果、南瓜)的食物。
33,躁鬱症,高風險,2.57,日常生活中勿給自己太大的壓力，找尋適合自己的方式來調適心情：像是靜態的冥想、聽音樂，或是動態的活動如跳舞、游泳等。飲食原則為均衡攝取多種食物，可吃香蕉來獲取色胺酸，幫助血清素正常製造。另外養成固定作息、每日充足睡眠，也能幫助穩定情緒。
43,口腔癌,高風險,2.14,絕大部分的口腔癌發生與抽煙、喝酒、嚼檳榔相關，高風險者宜避免上述習慣。每半年應定期做口腔健康檢查，並實行正確的刷牙方式，維持口腔衛生。飲食上可多攝取蔬菜及富含維生素C之水果（如芭樂、柑橘類），並避免過燙或太辣、太酸的刺激性食物。
46,肺癌,高風險,2.81,肺癌的防治宜從改善生活中的危險因子開始：不養成吸菸習慣或吸菸者立即戒菸，避免暴露在二手菸環境。飲食上則需改變容易造成油煙的烹調方式，例如以燉煮或烤箱料理代替油煎和油炒，並使用抽油煙機，維持通風良好。另外在空氣污染程度高的日子需配戴口罩。
47,胃癌,高風險,4.03,胃癌和飲食內容息息相關，飲食上宜避免油炸、煙燻、醃漬食物。可多攝取高麗菜、及富含黏液之蔬菜如秋葵及山藥。另外也應減少刺激性食物如酒精、濃茶及咖啡的攝取，減少刺激腸胃黏膜。幽門螺旋桿菌感染亦會增加其風險，除了至醫院做吹氣檢測外，日常中亦可補充益生菌。
48,肝癌,高風險,2.58,肝癌常由肝硬化發展而成，而造成肝硬化之原因除了藥物濫用之外，主要為酗酒所導致，因此要避免飲酒過量。另外病毒性肝炎也會增加肝癌罹患風險，故B型肝炎帶原者需注意追蹤。此外飲食中的黃麴毒素會造成肝毒性並誘發肝癌，所以日常宜減少花生及其製品（如花生粉、花生醬、花生湯）。
50,胰臟癌,高風險,2.55,應避免抽菸及過量飲酒，而肥胖及糖尿病皆會增加罹患風險，故宜注意體重控制，並監控血糖。飲食上宜避免精緻加工食品，並多攝取天然食材。胰臟癌之初期症狀不明顯，若突然出現不明原因之上腹痛伴隨背痛、體重莫名減輕或出現黃疸，宜盡速安排進階檢查（如腹部超音波、電腦斷層）。
