,female_disease,female_risk,female_disease_ratio,lifestyle
1,第二型糖尿病,高风险,3.65,首要注意体重的控制，若有过重的现象，需要做减重。平时养成规律的生活作息和运动习惯。饮食需避免本身含糖量过高或容易上升血糖的食物，例如含糖饮料、面包、汽水、蛋糕、饼干、糖果、白面包、白馒头、西瓜、煮的地瓜、烤马铃薯、松饼这些容易造成血糖大幅震荡。
2,高血压,高风险,3.02,饮食清淡为原则，避免过度调味的食物与烹饪方式(卤、炖、腌制食品)。建议多摄取高纤维未加工的天然食物(大麦、燕麦、糙米、蔬菜、水果)。钾离子的摄取有助于钠离子的排出，有助预防及改善高血压，包括香蕉、哈密瓜，西红柿、橙子、牛奶及芹菜等深绿色蔬菜可多选用。
16,多囊性卵巢症候群,高风险,2.18,切记做好体重管理，养成规律的运动习惯。饮食增加各种新鲜蔬果及全谷类的摄取，避免高油脂(如油炸油煎物、加工品)、重咸、加工(贡丸、火腿、香肠、汉堡肉)与精致高糖分食物(含糖饮料、面包、汽水、蛋糕、饼干)食物。蛋类、带壳海鲜及其相关制品须减少摄取，以免诱发荷尔蒙分泌。
23,脂肪肝,高风险,2.50,平时须随时注意体重控制，但千万勿以断食或长时间饥饿的方式减重。饮酒不过量并加上定期适度的运动可以预防脂肪肝。另外，饮食避免高油脂(如油炸油煎物、加工品)、重咸与精致高糖分食物(含糖饮料、面包、汽水、蛋糕、饼干)食物。抗氧化的食物都对肝脏有益，可以促进肝脏的代谢功能。例如含维他命C的食物如柑橘类、柠檬、青椒等。含维他命Ａ的食物如黄色的南瓜、木瓜、胡萝卜等，含维生素B群的食物如五谷杂粮类，还有微量矿物质如硒、锌都有抗氧化的作用，如蒜。卵磷脂可以促进肝脏的代谢，如蛋黄、大豆、玉米都有含有卵磷脂。
25,消化性溃疡、胃食道逆流,高风险,3.63,生活中应避免过高的精神压力、饮食避免高油脂(如油炸油煎物、加工品)、重咸与精致高糖分食物(含糖饮料、面包、汽水、蛋糕、饼干)食物。吃饭时须细嚼慢咽不可暴饮暴食，饭后半小时至一小时后可以做轻度的运动(散步、太极)，不可吃饱后立即躺下。食材方面可以选择秋葵、山药、黑白木耳有果胶和糖类组成的黏液，可保护胃壁，还可促进肠胃蠕动、防止便秘，是健胃润肠食材。
26,大肠息肉症,高风险,4.37,平时须随时注意体重控制。培养适度定期的运动避免长久性久坐。饮食避免高油脂(如油炸油煎物、加工品)、重咸与精致高糖分食物(含糖饮料、面包、汽水、蛋糕、饼干)食物。随时留意自己的排便频率。饮食以天然食物为主，另外增加各种蔬果的摄取比例，蛋白质比例以植物性蛋白质为主，例如豆腐、豆干、豆皮、豆包、黄豆、黑豆。食物可以多选用能增加抗氧化营养素食材(柠檬、甜椒、绿花椰菜、大蒜、洋葱、坚果、紫葡萄、柑橘、绿茶)的摄取以保护肠胃道。
47,胃癌,高风险,2.30,胃癌和饮食内容息息相关，饮食上宜避免油炸、烟熏、腌渍食物。可多摄取高丽菜、及富含黏液之蔬菜如秋葵及山药。另外也应减少刺激性食物如酒精、浓茶及咖啡的摄取，减少刺激肠胃黏膜。幽门螺旋杆菌感染亦会增加其风险，除了至医院做吹气检测外，日常中亦可补充益生菌。
